smartctl 7.4 2023-08-01 r5530 [x86_64-linux-6.8.0-49-generic] (local build)
Copyright (C) 2002-23, Bruce Allen, Christian Franke, www.smartmontools.org

=== START OF INFORMATION SECTION ===
Model Number:                       SAMSUNG MZPLJ12THALA-00007
Serial Number:                      S55LNG0R600048
Firmware Version:                   EPK9AB5Q
PCI Vendor/Subsystem ID:            0x144d
IEEE OUI Identifier:                0x002538
Total NVM Capacity:                 12,800,076,283,904 [12.8 TB]
Unallocated NVM Capacity:           1,804,960,006,144 [1.80 TB]
Controller ID:                      65
NVMe Version:                       1.3
Number of Namespaces:               32
Namespace 1 Size/Capacity:          10,995,116,277,760 [10.9 TB]
Namespace 1 Formatted LBA Size:     4096
Local Time is:                      Sat Feb 21 01:16:41 2026 UTC
Firmware Updates (0x17):            3 Slots, Slot 1 R/O, no Reset required
Optional Admin Commands (0x00df):   Security Format Frmw_DL NS_Mngmt Self_Test MI_Snd/Rec Vrt_Mngmt
Optional NVM Commands (0x007f):     Comp Wr_Unc DS_Mngmt Wr_Zero Sav/Sel_Feat Resv Timestmp
Log Page Attributes (0x0e):         Cmd_Eff_Lg Ext_Get_Lg Telmtry_Lg
Maximum Data Transfer Size:         32 Pages
Warning  Comp. Temp. Threshold:     80 Celsius
Critical Comp. Temp. Threshold:     87 Celsius

Supported Power States
St Op     Max   Active     Idle   RL RT WL WT  Ent_Lat  Ex_Lat
 0 +    25.00W   22.00W       -    0  0  0  0      180     180

Supported LBA Sizes (NSID 0x1)
Id Fmt  Data  Metadt  Rel_Perf
 0 -     512       0         1
 1 -     512       8         3
 2 +    4096       0         0
 3 -    4096       8         2
 4 -    4096      64         3

=== START OF SMART DATA SECTION ===
SMART overall-health self-assessment test result: PASSED

SMART/Health Information (NVMe Log 0x02)
Critical Warning:                   0x00
Temperature:                        44 Celsius
Available Spare:                    100%
Available Spare Threshold:          10%
Percentage Used:                    2%
Data Units Read:                    10,456,296,093 [5.35 PB]
Data Units Written:                 14,320,085,616 [7.33 PB]
Host Read Commands:                 47,687,004,888
Host Write Commands:                57,804,086,859
Controller Busy Time:               17,535
Power Cycles:                       126
Power On Hours:                     14,916
Unsafe Shutdowns:                   114
Media and Data Integrity Errors:    0
Error Information Log Entries:      0
Warning  Comp. Temperature Time:    0
Critical Comp. Temperature Time:    0
Temperature Sensor 1:               44 Celsius
Temperature Sensor 2:               41 Celsius
Temperature Sensor 3:               42 Celsius

Error Information (NVMe Log 0x01, 16 of 256 entries)
No Errors Logged

Read Self-test Log failed: Invalid Field in Command (0x002)

